The image with the Arabic text 'Your Feedback is Highly Appreciated' represents which Agile value?,V1: Individuals and Interactions,V2: Working Software,V3: Customer Collaboration,V4: Responding to Change,V3: Customer Collaboration
What is Agile Principle #1?,Welcome change,Satisfy the customer,Deliver frequently,Work together,Satisfy the customer
What is Agile Principle #2?,Welcome change,Satisfy the customer,Deliver frequently,Work together,Welcome change
What is Agile Principle #3?,Welcome change,Satisfy the customer,Deliver frequently,Work together,Deliver frequently
What is Agile Principle #6?,Trust and support,Face-to-face conversation,Working software,Sustainable development,Face-to-face conversation
What is Agile Principle #8?,Trust and support,Face-to-face conversation,Working software,Sustainable development,Sustainable development
What is Agile Principle #11?,Maintain simplicity,Self-organizing teams,Reflect and adjust,Continuous attention,Self-organizing teams
What is Agile Principle #12?,Maintain simplicity,Self-organizing teams,Reflect and adjust,Continuous attention,Reflect and adjust
Which analyst skill helps 'manage the pressure and risks associated with unclear situations'?,Technical,Business,Interpersonal,Management,Management
"What is defined as 'investing in foundational technologies like servers, networks, databases, and cloud storage'?",Infrastructure investment,Applications and Software investment,Cybersecurity investment,Data Analytics investment,Infrastructure investment
What is defined as 'investing in specialized software to improve specific business functions'?,Infrastructure investment,Applications and Software investment,Cybersecurity investment,Data Analytics investment,Applications and Software investment
What is defined as 'investments in... tools... that transform raw data into actionable insights'?,Infrastructure investment,Applications and Software investment,Data Analytics and BI investment,Cybersecurity investment,Data Analytics and BI investment
"What is defined as 'investing in security measures like firewalls, encryption, and intrusion detection'?",Infrastructure investment,Applications and Software investment,Data Analytics and BI investment,Cybersecurity investment,Cybersecurity investment
The value 'Automating' is defined as 'Doing things...'?,...faster,...better,...smarter,...cheaper,...faster
The value 'Informating' is defined as 'Doing things...'?,...faster,...better,...smarter,...cheaper,...better
The value 'Strategizing' is defined as 'Doing things...'?,...faster,...better,...smarter,...cheaper,...smarter
What financial metric assesses 'long-term financial benefits versus investment'?,ROI,Payback Period,NPV and IRR,Error Reduction,NPV and IRR
'Employee Productivity' and 'Task Completion Rate' are examples of what kind of metrics?,Financial Metrics,Operational Efficiency,Productivity Metrics,Customer-Related Metrics,Productivity Metrics
'Data Security & Compliance' and 'Knowledge Management' are examples of what?,Financial Metrics,Strategic Value,Risk & Intangible Benefits,Customer-Related Metrics,Risk & Intangible Benefits
"In the ROI example, what was the 'Initial Implementation Costs' total?","\$50,000","\$65,000","\$15,000","\$80,000","\$65,000"
"In the ROI example, what was the 'Ongoing Annual Costs' total?","\$50,000","\$65,000","\$15,000","\$80,000","\$15,000"
"In the ROI example, which benefit provided the most value?","Increased Sales (\$100,000)","Cost Savings (\$10,000)","Retention Improvement (\$15,000)","Hardware (\$10,000)","Increased Sales (\$100,000)"
Which of these is NOT listed as a 'Technological Building Block' in Lec 6?,Cloud Technology,IoT,Augmented Reality,Quantum Computing,Quantum Computing
What is 'IoT' (listed as a building block)?,Internet of Things,Internal of Things,Investment in Technology,Internet on Time,Internet of Things
Which cloud service 'Provides virtualized computing resources... such as virtual machines and storage'?,IaaS,PaaS,SaaS,BI,IaaS
Which cloud service 'Offers hardware and software tools for application development'?,IaaS,PaaS,SaaS,BI,PaaS
Which cloud service 'Delivers software applications over the internet on a subscription basis'?,IaaS,PaaS,SaaS,BI,SaaS
What is the 'worldwide network of computer networks built on common standards'?,Internet,Intranet,Extranet,World Wide Web,Internet
What is 'an information system running on internet infrastructure that provides access to billions of web pages'?,Internet,Intranet,Extranet,World Wide Web,World Wide Web
What is the 'standard markup language for Web pages'?,HTML,XML,HTTP,IP,HTML
What does TCP (Transmission Control Protocol) do?,Handles assembly and reassembly of packets,Is responsible for addressing and routing,Defines web page structure,Describes data,Handles assembly and reassembly of packets
What does IP (Internet Protocol) do?,Handles assembly and reassembly of packets,Is responsible for addressing and routing,Defines web page structure,Describes data,Is responsible for addressing and routing
A 'web browser accessing a website' is an example of what?,Client,Server,Router,Protocol,Client
A 'database server managing data access' is an example of what?,Client,Server,Router,Protocol,Server
What are 'Text formatted with embedded links'?,Hypertext,HTML,XML,HTTP,Hypertext
"Which E-commerce feature means the 'technology reaches across national boundaries, around the earth'?",Ubiquity,Global reach,Information richness,Interactivity,Global reach
Which E-commerce feature involves 'Personalization of marketing messages and customization of products'?,Information density,Interactivity,Personalization/Customization,Social technology,Personalization/Customization
Which E-commerce feature relates to 'User-generated content and social networks'?,Information density,Interactivity,Personalization/Customization,Social technology,Social technology
Netflix is an example of which E-commerce model?,B2C,B2B,C2C,C2B,B2C
Salesforce is an example of which E-commerce model?,B2C,B2B,C2C,C2B,B2B
eBay and OLX are examples of which E-commerce model?,B2C,B2B,C2C,C2B,C2C
Upwork is an example of which E-commerce model?,B2C,B2B,C2C,C2B,C2B
M-commerce' refers to e-commerce using what?,Social media,Mobile devices,Business contracts,Internal networks,Mobile devices
'S-commerce' refers to e-commerce enabled by what?,Social networks,Secure servers,Software as a Service,System development,Social networks
